"article_id","title","link","pub_date","summary","categories","media_url"
91,"Everything to know about Nvidia, from the stock to its AI chips","https://qz.com/nvidia-stock-ai-chips-market-cap-1851647728","2024-10-08 09:00:00","<img class=""type:primaryImage"" src=""https://i.kinja-img.com/image/upload/c_fit,q_80,w_636/e989a78d92952961ce408539c230caf9.jpg"" /><p><a class=""sc-1out364-0 dPMosf sc-145m8ut-0 lcFFec js_link"" href=""https://qz.com/nvidia-history-origin-ai-chip-jensen-huang-1851372906"" rel=""noopener noreferrer"" target=""_blank"">Nvidia</a> has emerged as one of the hottest <a class=""sc-1out364-0 dPMosf sc-145m8ut-0 lcFFec js_link"" href=""https://qz.com/ai-artificial-intelligence-glossary-vocabulary-terms-1851422473"" rel=""noopener noreferrer"" target=""_blank"">artificial intelligence</a> stocks on the market. The 31-year-old company’s meteoric rise is largely due to <a class=""sc-1out364-0 dPMosf sc-145m8ut-0 lcFFec js_link"" href=""https://qz.com/ai-stocks-dot-com-bubble-nvidia-google-microsoft-amazon-1851407019"" rel=""noopener noreferrer"" target=""_blank"">the recent AI boom</a>, which revealed the unexpected potential of its core product, the graphics processing units (GPUs), for AI development.<br /></p><p><a href=""https://qz.com/nvidia-stock-ai-chips-market-cap-1851647728"">Read more...</a></p>","[""nvidia"", ""business finance"", ""daniel ives"", ""virtual reality"", ""graphics processing unit"", ""wilmington trust investment advisors"", ""thomas monteiro"", ""gpgpu"", ""jensen huang"", ""nemo ai"", ""e ohman jor fonder"", ""nv1"", ""peapack private wealth management"", ""fonder ab"", ""big tech"", ""tony roth"", ""generative artificial intelligence"", ""david dietze"", ""microsoft"", ""wedbush securities"", ""apollo global management"", ""nemo ai platform"", ""securities and exchange commission"", ""ai boom"", ""wilmington trust investment"", ""intel""]","https://i.kinja-img.com/image/upload/c_fit,q_80,w_636/e989a78d92952961ce408539c230caf9.jpg"
92,"Why are the world's wealthiest families flocking to family offices?","https://qz.com/why-world-wealthiest-families-flocking-family-offices-1851665724","2024-10-08 09:00:00","<img class=""type:primaryImage"" src=""https://i.kinja-img.com/image/upload/c_fit,q_80,w_636/125a249558f2ae52fe8d92e668479a9d.jpg"" /><p>The wealthiest families in the world are increasingly investing their portfolios into risk assets rather than cash, a recent survey of more than 338 family offices revealed.<br /></p><p><a href=""https://qz.com/why-world-wealthiest-families-flocking-family-offices-1851665724"">Read more...</a></p>","[""business finance"", ""tax avoidance"", ""deloitte"", ""citi private bank"", ""wealth"", ""distribution of wealth"", ""citigroup"", ""investment management"", ""billionaire"", ""richard weintraub"", ""private equity"", ""high net worth individual"", ""family office""]","https://i.kinja-img.com/image/upload/c_fit,q_80,w_636/125a249558f2ae52fe8d92e668479a9d.jpg"
93,"The top 10 mental health apps to try on World Mental Health Day","https://qz.com/calm-finch-world-mental-health-day-apps-1851666018","2024-10-08 09:00:00","<img class=""type:primaryImage"" src=""https://i.kinja-img.com/image/upload/c_fit,q_80,w_636/963bf2891df7c3e19106b56cec7c8c98.jpg"" /><p>In honor of World Mental Health Day on October 10 and National Depression and Mental Health Screening Month, we’re highlighting apps aiming to assist the millions of people seeking to improve their mental health. In 2019, an estimated <a class=""sc-1out364-0 dPMosf sc-145m8ut-0 lcFFec js_link"" href=""https://www.who.int/publications/i/item/9789240049338"" rel=""noopener noreferrer"" target=""_blank"">970 million people</a> worldwide were living with a mental disorder, according to the…</p><p><a href=""https://qz.com/calm-finch-world-mental-health-day-apps-1851666018"">Read more...</a></p>","[""health"", ""mental health"", ""meditation"", ""health medical pharma"", ""calm"", ""duolingo"", ""apple"", ""mindfulness"", ""technology internet"", ""fitness apps"", ""headspace"", ""mindfulness and technology"", ""health software"", ""effects of meditation""]","https://i.kinja-img.com/image/upload/c_fit,q_80,w_636/963bf2891df7c3e19106b56cec7c8c98.jpg"
94,"Costco's gold bars are selling out fast","https://qz.com/costco-gold-bars-metal-silver-platinum-retail-consumer-1851667327","2024-10-07 22:15:00","<img class=""type:primaryImage"" src=""https://i.kinja-img.com/image/upload/c_fit,q_80,w_636/eea1067b4d236d6ea531b3add498e85e.jpg"" /><p>In a striking display of <a class=""sc-1out364-0 dPMosf sc-145m8ut-0 lcFFec js_link"" href=""https://qz.com/costco-platinum-bars-gold-and-silver-retail-consumers-1851663436"" rel=""noopener noreferrer"" target=""_blank"">shifting</a> consumer behavior, Costco (<a class=""sc-1out364-0 dPMosf sc-145m8ut-0 lcFFec js_link"" href=""https://qz.com/quote/COST"" rel=""noopener noreferrer"" target=""_blank"">COST</a>) Wholesale gold bars are disappearing from shelves faster than they can be restocked. </p><p><a href=""https://qz.com/costco-gold-bars-metal-silver-platinum-retail-consumer-1851667327"">Read more...</a></p>","[""costco"", ""gold"", ""business finance"", ""platinum as an investment"", ""wells fargo"", ""ounce"", ""precious metals"", ""gold bar""]","https://i.kinja-img.com/image/upload/c_fit,q_80,w_636/eea1067b4d236d6ea531b3add498e85e.jpg"
95,"FTX shareholders could get $1 billion after crypto firm is cleared to fully repay customers","https://qz.com/ftx-shareholders-billion-seized-crypto-exchange-sbf-1851667188","2024-10-07 20:51:00","<img class=""type:primaryImage"" src=""https://i.kinja-img.com/image/upload/c_fit,q_80,w_636/a0da3871c4dbf126245cc0ae4a47b7bd.jpg"" /><p>A judge has reportedly approved payments to customers of collapsed crypto exchange FTX — and its shareholders could get $1 billion in seized assets. </p><p><a href=""https://qz.com/ftx-shareholders-billion-seized-crypto-exchange-sbf-1851667188"">Read more...</a></p>","[""ftx"", ""john dorsey"", ""sam bankman"", ""business finance"", ""corporate crime"", ""gary wang"", ""bankman fried"", ""cryptocurrency exchange"", ""ken pasquale"", ""anthropic"", ""joseph bankman"", ""cryptocurrencies"", ""bankruptcy of ftx"", ""united states v bankman fried"", ""sam bankman fried"", ""law crime""]","https://i.kinja-img.com/image/upload/c_fit,q_80,w_636/a0da3871c4dbf126245cc0ae4a47b7bd.jpg"
96,"Christine McVie’s Fleetwood Mac scrapbook, Dianne Feinstein’s books, and an iconic Marilyn Monroe portrait: this week’s auction block roundup","https://qz.com/this-week-s-auction-block-roundup-1851667217","2024-10-07 20:19:00","<img class=""type:primaryImage"" src=""https://i.kinja-img.com/image/upload/c_fit,q_80,w_636/b08a23f0ad44536bd2d771ef878965b7.jpg"" /><p>Each week Quartz highlights the upcoming and ongoing sales at auction houses across the world. Among the items available are works of art, historical artifacts, and pop culture memorabilia that collectors won’t want to miss out on. While some of these objects go for millions, others are simultaneously affordable and…</p><p><a href=""https://qz.com/this-week-s-auction-block-roundup-1851667217"">Read more...</a></p>","[""auction"", ""dianne feinstein"", ""fleetwood mac"", ""marilyn monroe"", ""tiffany and co"", ""heritage auctions"", ""leslie ragan"", ""alexander fleming"", ""sothebys"", ""bonhams"", ""penicillin"", ""julien christine mcvie"", ""swann galleries"", ""adam smith"", ""richard avedon""]","https://i.kinja-img.com/image/upload/c_fit,q_80,w_636/b08a23f0ad44536bd2d771ef878965b7.jpg"
97,"McDonald's is suing Tyson Foods for allegedly choking the beef supply chain to raise prices","https://qz.com/mcdonalds-sues-tyson-foods-jbs-cargill-beef-supply-1851667117","2024-10-07 19:56:00","<img class=""type:primaryImage"" src=""https://i.kinja-img.com/image/upload/c_fit,q_80,w_636/c05075daf60d07669013f7602b944647.jpg"" /><p><a class=""sc-1out364-0 dPMosf sc-145m8ut-0 lcFFec js_link"" href=""https://qz.com/mcdonalds-chicken-big-mac-retail-consumers-1851664859"" rel=""noopener noreferrer"" target=""_blank"">McDonald’s</a> has filed a <a class=""sc-1out364-0 dPMosf sc-145m8ut-0 lcFFec js_link"" href=""https://fingfx.thomsonreuters.com/gfx/legaldocs/jnvwjeeakpw/McDonald's%20v%20Cargill%20-%20EDNY%20-%2020241004.pdf"" rel=""noopener noreferrer"" target=""_blank"">lawsuit</a> against Tyson Foods (<a class=""sc-1out364-0 dPMosf sc-145m8ut-0 lcFFec js_link"" href=""https://qz.com/quote/TSN"" rel=""noopener noreferrer"" target=""_blank"">TSN</a>), JBS, and other  major meat processing companies, accusing them of colluding for years to limit beef supplies.<br /></p><p><a href=""https://qz.com/mcdonalds-sues-tyson-foods-jbs-cargill-beef-supply-1851667117"">Read more...</a></p>","[""tyson foods"", ""beef"", ""mcdonald s"", ""target"", ""meat packers"", ""kroger"", ""jbs sa"", ""jbs usa"", ""meat industry"", ""jbs"", ""cargill"", ""law crime"", ""national beef"", ""meat packing industry""]","https://i.kinja-img.com/image/upload/c_fit,q_80,w_636/c05075daf60d07669013f7602b944647.jpg"
98,"Donald Trump's plans would cut taxes on the richest 5% of America — and raise them for everyone else","https://qz.com/donald-trump-tax-cuts-wealthiest-americans-tarrifs-1851667005","2024-10-07 19:07:00","<img class=""type:primaryImage"" src=""https://i.kinja-img.com/image/upload/c_fit,q_80,w_636/003c6e4fa140321f294be54cd74a46d5.jpg"" /><p>Former President Donald Trump has promised to slash — or scrap — a lot of taxes. But his plans to hike tariffs on imports would “more than offset” those tax cuts for all but the richest 5% of Americans, according to a <a class=""sc-1out364-0 dPMosf sc-145m8ut-0 lcFFec js_link"" href=""https://itep.org/a-distributional-analysis-of-donald-trumps-tax-plan-2024/"" rel=""noopener noreferrer"" target=""_blank"">new analysis</a>. </p><p><a href=""https://qz.com/donald-trump-tax-cuts-wealthiest-americans-tarrifs-1851667005"">Read more...</a></p>","[""donald trump"", ""tax"", ""presidency of donald trump"", ""economic policy of the donald trump administration"", ""taxation in the united states"", ""united states federal budget"", ""tax cut"", ""child tax credit"", ""tax cuts and jobs act"", ""social issues"", ""political debates about the united states federal budget"", ""kamala harris"", ""state and local tax deduction""]","https://i.kinja-img.com/image/upload/c_fit,q_80,w_636/003c6e4fa140321f294be54cd74a46d5.jpg"
99,"Super Micro Computer stock surges 15% on big AI demand","https://qz.com/super-micro-computer-stock-shares-surge-ai-demand-gpu-1851667019","2024-10-07 19:05:36","<img class=""type:primaryImage"" src=""https://i.kinja-img.com/image/upload/c_fit,q_80,w_636/b0757900a5910da0c80f614a0b1b05db.jpg"" /><p>Server company Super Micro Computer (<a class=""sc-1out364-0 dPMosf sc-145m8ut-0 lcFFec js_link"" href=""https://qz.com/quote/SMCI"" rel=""noopener noreferrer"" target=""_blank"">SMCI</a>) unveiled a new liquid cooling solution for AI data centers on Monday, while also revealing it’s shipping over 100,000 graphics processing units (GPUs) quarterly — news that sent its stock climbing more than 15% in midday trading.</p><p><a href=""https://qz.com/super-micro-computer-stock-shares-surge-ai-demand-gpu-1851667019"">Read more...</a></p>","[""super micro computer"", ""business finance"", ""artificial intelligence"", ""supermicro"", ""data center"", ""charles liang"", ""gpgpu"", ""graphics processing unit"", ""smci""]","https://i.kinja-img.com/image/upload/c_fit,q_80,w_636/b0757900a5910da0c80f614a0b1b05db.jpg"
100,"A hot meal on a transatlantic JetBlue flight will now cost extra","https://qz.com/jetblue-transatlantic-hot-food-cut-1851667000","2024-10-07 18:28:00","<img class=""type:primaryImage"" src=""https://i.kinja-img.com/image/upload/c_fit,q_80,w_636/4d23d5624d6070712e3d63ca64bc48a1.jpg"" /><p>JetBlue is making a big change to its transatlantic flight offerings. CNN (<a class=""sc-1out364-0 dPMosf sc-145m8ut-0 lcFFec js_link"" href=""https://qz.com/quote/WBD"" rel=""noopener noreferrer"" target=""_blank"">WBD</a>) reports that the company’s “core” fares flying to Europe and the U.K. will <a class=""sc-1out364-0 dPMosf sc-145m8ut-0 lcFFec js_link"" href=""https://www.cnn.com/2024/10/07/travel/jetblue-drops-hot-meals-economy-passengers/index.html"" rel=""noopener noreferrer"" target=""_blank"">no longer come</a> with hot meals.</p><p><a href=""https://qz.com/jetblue-transatlantic-hot-food-cut-1851667000"">Read more...</a></p>","[""jetblue"", ""joanna geraghty"", ""passenger rail transport"", ""airline tickets"", ""us airways"", ""spirit airlines"", ""jetblue airways"", ""transatlantic flight""]","https://i.kinja-img.com/image/upload/c_fit,q_80,w_636/4d23d5624d6070712e3d63ca64bc48a1.jpg"
101,"EV chargers that feel more like a gas station are coming","https://qz.com/rove-ev-charger-gas-station-california-1851667059","2024-10-07 18:21:41","<img class=""type:primaryImage"" src=""https://i.kinja-img.com/image/upload/c_fit,q_80,w_636/d58fbe47c8ba02fee3d888b4ff0d6805.png"" /><p>One major key to EV adoption is creating a comprehensive charging network. Not only does it have to be <a class=""sc-1out364-0 dPMosf sc-145m8ut-0 lcFFec js_link"" href=""https://jalopnik.com/ev-charging-should-be-so-much-easier-1850784127?_gl=1*169sb8c*_ga*MTM0NDQ4ODA2My4xNzIyMzc4NDE0*_ga_V4QNJTT5L0*MTcyODMwMTQ1Ny4xMTguMS4xNzI4MzA1Njk0LjU3LjAuMA.."">convenient</a>, it has to be <a class=""sc-1out364-0 dPMosf sc-145m8ut-0 lcFFec js_link"" href=""https://jalopnik.com/non-tesla-evs-are-having-a-hard-time-using-supercharger-1851662200?_gl=1*169sb8c*_ga*MTM0NDQ4ODA2My4xNzIyMzc4NDE0*_ga_V4QNJTT5L0*MTcyODMwMTQ1Ny4xMTguMS4xNzI4MzA1Njk0LjU3LjAuMA.."">appealing</a>.  One company is making a valiant attempt with its new gas station-like EV chargers. </p><p><a href=""https://qz.com/rove-ev-charger-gas-station-california-1851667059"">Read more...</a></p>","[""charging stations"", ""electric vehicles""]","https://i.kinja-img.com/image/upload/c_fit,q_80,w_636/d58fbe47c8ba02fee3d888b4ff0d6805.png"
102,"Bankrupt EV startup Fisker left its abandoned headquarters in 'complete disarray'","https://qz.com/fisker-bankruptcy-evs-headquarters-lawsuit-1851667041","2024-10-07 18:18:10","<img class=""type:primaryImage"" src=""https://i.kinja-img.com/image/upload/c_fit,q_80,w_636/1b6194a6700ba7915bcebc87bf5f1507.png"" /><p><a class=""sc-1out364-0 dPMosf sc-145m8ut-0 lcFFec js_link"" href=""https://jalopnik.com/fisker-is-dead-but-its-legal-troubles-are-just-beginnin-1851666516"">Fisker can’t seem to do anything right</a> – and that includes closing up shop. Apparently, the <a class=""sc-1out364-0 dPMosf sc-145m8ut-0 lcFFec js_link"" href=""https://jalopnik.com/fisker-resorts-to-fixing-customer-cars-with-preproducti-1851454868?_gl=1*1un33re*_ga*MTI1NTUyODY0OS4xNjgzODI2NTIz*_ga_V4QNJTT5L0*MTcyODMxOTM1OC4xMzMuMS4xNzI4MzE5NTU3LjQ5LjAuMA.."">La Palma, California headquarters</a> of <a class=""sc-1out364-0 dPMosf sc-145m8ut-0 lcFFec js_link"" href=""https://jalopnik.com/comedy-of-errors-led-to-fisker-s-bankruptcy-1851550234"">the now-dead automaker</a> was abandoned and left in “complete disarray” with full-size <a class=""sc-1out364-0 dPMosf sc-145m8ut-0 lcFFec js_link"" href=""https://jalopnik.com/gm-clay-sculptor-buys-the-shittiest-car-in-the-junkyard-1844575033"">clay models,</a> automotive equipment, <a class=""sc-1out364-0 dPMosf sc-145m8ut-0 lcFFec js_link"" href=""https://jalopnik.com/real-world-solid-state-batteries-are-here-and-its-blowi-1851595209"">EV batteries </a>and hazardous waste left behind.</p><p><a href=""https://qz.com/fisker-bankruptcy-evs-headquarters-lawsuit-1851667041"">Read more...</a></p>","[""fisker"", ""aston martin"", ""heritage global partners"", ""hpg"", ""sports sedans"", ""fisker karma"", ""henrik fisker"", ""full size vehicles"", ""tony lenzini"", ""fisker inc"", ""nick dove"", ""fisker automotive"", ""luxury vehicles""]","https://i.kinja-img.com/image/upload/c_fit,q_80,w_636/1b6194a6700ba7915bcebc87bf5f1507.png"
103,"A Frontier Airlines flight trailed flames as it landed","https://qz.com/frontier-airlines-flight-flames-land-las-vegas-airbus-1851667033","2024-10-07 18:14:32","<video loop="""" poster=""https://i.kinja-img.com/image/upload/c_fit,q_80,w_636/76a04059b0e2d273d3844bf96c600130.jpg""><source src=""https://i.kinja-img.com/image/upload/c_fit,q_80,w_636/76a04059b0e2d273d3844bf96c600130.mp4"" type=""video/mp4"" /></video><p>Clapping when a flight lands may be a fading tradition, but it’s fully deserved some days. Passengers on <a class=""sc-1out364-0 dPMosf sc-145m8ut-0 lcFFec js_link"" href=""https://jalopnik.com/frontier-launches-149-monthly-unlimited-flight-pass-wi-1850696796"">a Frontier Airlines flight</a> certainly had a reason for applause on Saturday after the flight from San Diego trailed flames from its landing gear while landing at <a class=""sc-1out364-0 dPMosf sc-145m8ut-0 lcFFec js_link"" href=""https://jalopnik.com/passenger-threatened-to-bomb-vegas-airport-because-he-c-1851647377"">Harry Reid International Airport</a> in Las Vegas. All…</p><p><a href=""https://qz.com/frontier-airlines-flight-flames-land-las-vegas-airbus-1851667033"">Read more...</a></p>","[""frontier airlines"", ""disaster accident"", ""boeing 777"", ""john glenn columbus international airport"", ""airbus"", ""miami international airport"", ""philadelphia international airport"", ""harry reid international airport"", ""united airlines"", ""orlando international airport""]","https://i.kinja-img.com/image/upload/c_fit,q_80,w_636/76a04059b0e2d273d3844bf96c600130.gif"
104,"A classic Hamptons home, cliffside Beverly Hills bungalow and mansion-sized Manhattan townhouse: This week’s real estate roundup","https://qz.com/most-fabulous-real-estate-listings-oct-2024-1851666947","2024-10-07 17:58:00","<img class=""type:primaryImage"" src=""https://i.kinja-img.com/image/upload/c_fit,q_80,w_636/5c7b422cd1d4376df2c5bd5cab800146.jpg"" /><p>Each week Quartz highlights the most luxurious real estate listings across the country. These properties feature remarkable views, enviable locations, and lavish amenities — and they’re all on the market right now. Check out the best homes that are available with upcoming open houses.<br /></p><p><a href=""https://qz.com/most-fabulous-real-estate-listings-oct-2024-1851666947"">Read more...</a></p>","[""real estate"", ""apartment"", ""le palais beverly hills"", ""frank lloyd wright"", ""truman aldrich"", ""russell barr williamson"", ""hospitality recreation"", ""alfred browning parker""]","https://i.kinja-img.com/image/upload/c_fit,q_80,w_636/5c7b422cd1d4376df2c5bd5cab800146.jpg"
105,"Trump Media stock spikes 15% after Elon Musk came to a campaign rally","https://qz.com/trump-media-djt-elon-musk-campaign-rally-butler-1851666928","2024-10-07 17:46:23","<img class=""type:primaryImage"" src=""https://i.kinja-img.com/image/upload/c_fit,q_80,w_636/c44a202c802d764879de499d29565f49.jpg"" /><p><a class=""sc-1out364-0 dPMosf sc-145m8ut-0 lcFFec js_link"" href=""https://qz.com/trump-media-djt-stock-chart-market-cap-truth-social-1851430157?_gl=1*1gzgwni*_ga*MTY1NjQyMDgwNC4xNzIxMDcwOTUy*_ga_V4QNJTT5L0*MTcyODMxOTg5MS4yNTkuMC4xNzI4MzE5ODkzLjU4LjAuMA.."" rel=""noopener noreferrer"" target=""_blank"">Trump Media & Technology Group</a> stock spiked more than 15% Monday after Tesla (<a class=""sc-1out364-0 dPMosf sc-145m8ut-0 lcFFec js_link"" href=""https://qz.com/quote/TSLA"" rel=""noopener noreferrer"" target=""_blank"">TSLA</a>) and SpaceX chief Elon Musk <a class=""sc-1out364-0 dPMosf sc-145m8ut-0 lcFFec js_link"" href=""https://www.politico.com/news/2024/10/05/elon-musk-trump-butler-rally-00182615"" rel=""noopener noreferrer"" target=""_blank"">appeared next to former President Donald Trump</a> at a campaign rally Saturday.<br /></p><p><a href=""https://qz.com/trump-media-djt-elon-musk-campaign-rally-butler-1851666928"">Read more...</a></p>","[""elon musk"", ""business finance"", ""tesla"", ""trump media technology group"", ""donald trump"", ""politics"", ""trumpism"", ""planned presidential transition of donald trump"", ""spacex"", ""kamala harris"", ""time person of the year"", ""truth social"", ""conservatism in the united states"", ""views of elon musk"", ""qanon"", ""the trump organization"", ""freedom of speech""]","https://i.kinja-img.com/image/upload/c_fit,q_80,w_636/c44a202c802d764879de499d29565f49.jpg"
106,"Panera Bread settled a Charged Lemonade lawsuit after a student's death","https://qz.com/panera-settles-lawsuit-death-charged-lemonade-1851666844","2024-10-07 17:24:26","<img class=""type:primaryImage"" src=""https://i.kinja-img.com/image/upload/c_fit,q_80,w_636/e73238ef5af36a137eb5afbe7f22b301.jpg"" /><p>Panera Bread has reached an agreement with the family of an Ivy League student who tragically passed away after consuming its <a class=""sc-1out364-0 dPMosf sc-145m8ut-0 lcFFec js_link"" href=""https://qz.com/panera-charged-up-lemonade-lawsuits-1851461401?_gl=1*mfrlcd*_ga*MTkzNTUxMDgwMy4xNzI0MjQ2NjI3*_ga_V4QNJTT5L0*MTcyODMxMDQzMS44NS4xLjE3MjgzMTgxNDAuNjAuMC4w"" rel=""noopener noreferrer"" target=""_blank"">now-discontinued Charged Lemonade</a>, as first <a class=""sc-1out364-0 dPMosf sc-145m8ut-0 lcFFec js_link"" href=""https://www.nbcnews.com/news/us-news/panera-settles-first-plaintiff-charged-lemonade-wrongful-death-suits-rcna174244"" rel=""noopener noreferrer"" target=""_blank"">reported</a> by NBC News (<a class=""sc-1out364-0 dPMosf sc-145m8ut-0 lcFFec js_link"" href=""https://qz.com/quote/CMCSA"" rel=""noopener noreferrer"" target=""_blank"">CMCSA</a>). </p><p><a href=""https://qz.com/panera-settles-lawsuit-death-charged-lemonade-1851666844"">Read more...</a></p>","[""panera bread"", ""lemonade"", ""fast casual restaurants"", ""restaurant franchises"", ""caffeine"", ""four loko"", ""energy drinks"", ""caffeinated drink"", ""culture of st louis"", ""alcopops"", ""law crime"", ""sarah katz"", ""elizabeth crawford"", ""ivy league"", ""v""]","https://i.kinja-img.com/image/upload/c_fit,q_80,w_636/e73238ef5af36a137eb5afbe7f22b301.jpg"
107,"Tesla Cybertrucks are still being insured by Geico — despite claims otherwise","https://qz.com/tesla-cybertruck-geico-insurance-evs-elon-musk-1851666695","2024-10-07 17:20:10","<img class=""type:primaryImage"" src=""https://i.kinja-img.com/image/upload/c_fit,q_80,w_636/9846be04a6b746c04929a59b9eaa597d.jpg"" /><p>Geico (<a class=""sc-1out364-0 dPMosf sc-145m8ut-0 lcFFec js_link"" href=""https://qz.com/quote/BRK.A"" rel=""noopener noreferrer"" target=""_blank"">BRK.A</a>) on Monday denied that it has stopped underwriting Tesla’s (<a class=""sc-1out364-0 dPMosf sc-145m8ut-0 lcFFec js_link"" href=""https://qz.com/quote/TSLA"" rel=""noopener noreferrer"" target=""_blank"">TSLA</a>) Cybertruck electric pickups after claims circulated on social media and <a class=""sc-1out364-0 dPMosf sc-145m8ut-0 lcFFec js_link"" href=""https://www.cybertruckownersclub.com/forum/threads/geico-cancelling-all-cybertruck-insurance-policies-what.24927/"" rel=""noopener noreferrer"" target=""_blank"">enthusiast forums</a>.</p><p><a href=""https://qz.com/tesla-cybertruck-geico-insurance-evs-elon-musk-1851666695"">Read more...</a></p>","[""tesla"", ""tesla cybertruck"", ""rivian"", ""robert stevenson"", ""electric pickup"", ""tesla inc"", ""gmc"", ""general motors"", ""musk"", ""ford motor"", ""elon musk""]","https://i.kinja-img.com/image/upload/c_fit,q_80,w_636/9846be04a6b746c04929a59b9eaa597d.jpg"
108,"Boeing is restarting talks to end a strike some compare to an economic Hurricane Helene","https://qz.com/boeing-strike-negotiations-act-of-god-1851666732","2024-10-07 17:10:00","<img class=""type:primaryImage"" src=""https://i.kinja-img.com/image/upload/c_fit,q_80,w_636/d87cb7e4a4775685ef265d4b4f06a837.jpg"" /><p>Boeing (<a class=""sc-1out364-0 dPMosf sc-145m8ut-0 lcFFec js_link"" href=""https://qz.com/quote/BA"" rel=""noopener noreferrer"" target=""_blank"">BA</a>) is back at the table with the machinists who <a class=""sc-1out364-0 dPMosf sc-145m8ut-0 lcFFec js_link"" href=""https://qz.com/boeing-machinis-union-labor-strike-contract-wages-1851647608"" rel=""noopener noreferrer"" target=""_blank"">have been on strike</a> for more than three weeks. Some economy observers are comparing the work stoppage’s impact to that of Hurricane Helene.</p><p><a href=""https://qz.com/boeing-strike-negotiations-act-of-god-1851666732"">Read more...</a></p>","[""boeing"", ""disaster accident"", ""international transport workers federation"", ""boeing machinists strike"", ""international association of machinists and aerospace workers"", ""boeing south carolina"", ""aerospace"", ""labor"", ""federal mediation and conciliation service"", ""international federation of building and wood workers"", ""international association"", ""international metalworkers federation""]","https://i.kinja-img.com/image/upload/c_fit,q_80,w_636/d87cb7e4a4775685ef265d4b4f06a837.jpg"
